{
  "run_id": "run_20260220T172135650598_0c18ee59",
  "created_at": "2026-02-20T17:21:35.678699+00:00",
  "config_hash": "0c18ee591d2d8696",
  "data_snapshot_id": "7828d96cb3ec0dfc",
  "git_commit": "50fb18a",
  "random_seed": 42,
  "system_info": {
    "python_version": "3.11.9 (tags/v3.11.9:de54cf5, Apr  2 2024, 10:12:12) [MSC v.1938 64 bit (AMD64)]",
    "platform": "Windows-10-10.0.26200-SP0",
    "numpy_version": "2.4.2",
    "sklearn_version": "1.8.0",
    "pandas_version": "3.0.1"
  },
  "stages": {
    "ingest_preprocess": {
      "name": "ingest_preprocess",
      "status": "completed",
      "started_at": "2026-02-20T17:21:39.518379+00:00",
      "completed_at": "2026-02-20T17:21:46.593107+00:00",
      "duration_seconds": 7.07,
      "error": null
    },
    "psychometrics": {
      "name": "psychometrics",
      "status": "completed",
      "started_at": "2026-02-20T17:21:46.595106+00:00",
      "completed_at": "2026-02-20T17:21:47.045209+00:00",
      "duration_seconds": 0.45,
      "error": null
    },
    "splits": {
      "name": "splits",
      "status": "completed",
      "started_at": "2026-02-20T17:21:47.048206+00:00",
      "completed_at": "2026-02-20T17:21:47.300988+00:00",
      "duration_seconds": 0.25,
      "error": null
    },
    "text_tasks": {
      "name": "text_tasks",
      "status": "completed",
      "started_at": "2026-02-20T17:21:47.306992+00:00",
      "completed_at": "2026-02-20T17:32:23.244021+00:00",
      "duration_seconds": 635.94,
      "error": null
    },
    "fusion": {
      "name": "fusion",
      "status": "completed",
      "started_at": "2026-02-20T17:32:23.276034+00:00",
      "completed_at": "2026-02-20T17:33:34.321580+00:00",
      "duration_seconds": 71.05,
      "error": null
    },
    "contradiction": {
      "name": "contradiction",
      "status": "completed",
      "started_at": "2026-02-20T17:33:34.339005+00:00",
      "completed_at": "2026-02-20T17:33:34.453731+00:00",
      "duration_seconds": 0.11,
      "error": null
    },
    "evaluation": {
      "name": "evaluation",
      "status": "completed",
      "started_at": "2026-02-20T17:33:34.460720+00:00",
      "completed_at": "2026-02-20T17:33:48.577345+00:00",
      "duration_seconds": 14.12,
      "error": null
    },
    "reporting": {
      "name": "reporting",
      "status": "completed",
      "started_at": "2026-02-20T17:33:48.600348+00:00",
      "completed_at": "2026-02-20T17:33:48.791507+00:00",
      "duration_seconds": 0.19,
      "error": null
    }
  }
}