{
  "run_id": "run_20260220T170743013198_0c18ee59",
  "created_at": "2026-02-20T17:07:43.015179+00:00",
  "config_hash": "0c18ee591d2d8696",
  "data_snapshot_id": "unknown",
  "git_commit": "50fb18a",
  "random_seed": 42,
  "system_info": {
    "python_version": "3.11.9 (tags/v3.11.9:de54cf5, Apr  2 2024, 10:12:12) [MSC v.1938 64 bit (AMD64)]",
    "platform": "Windows-10-10.0.26200-SP0",
    "numpy_version": "2.4.2",
    "sklearn_version": "1.8.0",
    "pandas_version": "3.0.1"
  },
  "stages": {}
}